20,21,,뉴트로지나 메이크업 리무버 클렌징 페이스 Wipes 워터프루프 메이크업과 마스카라 무알코올 밸류 트윈팩 25카운트 2팩:,no_brand,,,,,,단일옵션,"22,700원",2021-01-13 15:58:11.305290,,,,./img_files_in_coupang_baby_title/product/물티슈/건티슈/no_brand/뉴트로지나 메이크업 리무버 클렌징 페이스 Wipes 워터프루프 메이크업과 마스카라 무알코올 밸류 트윈팩 25카운트 2팩:.jpg,"./img_files_in_coupang_baby_title/product_detail/물티슈/건티슈/no_brand/뉴트로지나 메이크업 리무버 클렌징 페이스 Wipes 워터프루프 메이크업과 마스카라 무알코올 밸류 트윈팩 25카운트 2팩:/뉴트로지나 메이크업 리무버 클렌징 페이스 Wipes 워터프루프 메이크업과 마스카라 무알코올 밸류 트윈팩 25카운트 2팩:_0.jpg,./img_files_in_coupang_baby_title/product_detail/물티슈/건티슈/no_brand/뉴트로지나 메이크업 리무버 클렌징 페이스 Wipes 워터프루프 메이크업과 마스카라 무알코올 밸류 트윈팩 25카운트 2팩:/뉴트로지나 메이크업 리무버 클렌징 페이스 Wipes 워터프루프 메이크업과 마스카라 무알코올 밸류 트윈팩 25카운트 2팩:_1.jpg",https://www.coupang.com/vp/products/4343794290?itemId=5087929354&vendorItemId=72397548849&sourceType=CATEGORY&categoryId=485881
21,22,,Care Touch Lens Cleaning Wipes 210 Pre-Moistated and Indrivate Waper Lens Cleaning Wipes for Eyeglass Tablets Camera,no_brand,,,,,,단일옵션,"28,600원",2021-01-13 15:58:26.585856,,,,./img_files_in_coupang_baby_title/product/물티슈/건티슈/no_brand/Care Touch Lens Cleaning Wipes 210 Pre-Moistated and Indrivate Waper Lens Cleaning Wipes for Eyeglass Tablets Camera.jpg,"./img_files_in_coupang_baby_title/product_detail/물티슈/건티슈/no_brand/Care Touch Lens Cleaning Wipes 210 Pre-Moistated and Indrivate Waper Lens Cleaning Wipes for Eyeglass Tablets Camera/Care Touch Lens Cleaning Wipes 210 Pre-Moistated and Indrivate Waper Lens Cleaning Wipes for Eyeglass Tablets Camera_0.jpg,./img_files_in_coupang_baby_title/product_detail/물티슈/건티슈/no_brand/Care Touch Lens Cleaning Wipes 210 Pre-Moistated and Indrivate Waper Lens Cleaning Wipes for Eyeglass Tablets Camera/Care Touch Lens Cleaning Wipes 210 Pre-Moistated and Indrivate Waper Lens Cleaning Wipes for Eyeglass Tablets Camera_1.jpg",https://www.coupang.com/vp/products/4343794415?itemId=5087929827&vendorItemId=72397548791&sourceType=CATEGORY&categoryId=485881
22,23,,칸두의 아기 및 어린이용 수세성 물티슈프 민감성 피부용 무향 저자극 포티 트레이닝 습식 클렌징 클로즈 42 카운트 12의,no_brand,,,,,,단일옵션,"40,400원",2021-01-13 15:58:41.904747,,,,./img_files_in_coupang_baby_title/product/물티슈/건티슈/no_brand/칸두의 아기 및 어린이용 수세성 물티슈프 민감성 피부용 무향 저자극 포티 트레이닝 습식 클렌징 클로즈 42 카운트 12의.jpg,"./img_files_in_coupang_baby_title/product_detail/물티슈/건티슈/no_brand/칸두의 아기 및 어린이용 수세성 물티슈프 민감성 피부용 무향 저자극 포티 트레이닝 습식 클렌징 클로즈 42 카운트 12의/칸두의 아기 및 어린이용 수세성 물티슈프 민감성 피부용 무향 저자극 포티 트레이닝 습식 클렌징 클로즈 42 카운트 12의_0.jpg,./img_files_in_coupang_baby_title/product_detail/물티슈/건티슈/no_brand/칸두의 아기 및 어린이용 수세성 물티슈프 민감성 피부용 무향 저자극 포티 트레이닝 습식 클렌징 클로즈 42 카운트 12의/칸두의 아기 및 어린이용 수세성 물티슈프 민감성 피부용 무향 저자극 포티 트레이닝 습식 클렌징 클로즈 42 카운트 12의_1.jpg",https://www.coupang.com/vp/products/4343794010?itemId=5087928443&vendorItemId=72397548840&sourceType=CATEGORY&categoryId=485881
23,24,,아미슬리 코튼 페이스 타월 울트라 소프트 린트가 없는 페이셜 코튼 티슈 민감성 피부를 위한 일회용 60Pcs 일회용 물티슈,no_brand,,,,,,단일옵션,"24,700원",2021-01-13 15:58:57.197351,,,,./img_files_in_coupang_baby_title/product/물티슈/건티슈/no_brand/아미슬리 코튼 페이스 타월 울트라 소프트 린트가 없는 페이셜 코튼 티슈 민감성 피부를 위한 일회용 60Pcs 일회용 물티슈.jpg,"./img_files_in_coupang_baby_title/product_detail/물티슈/건티슈/no_brand/아미슬리 코튼 페이스 타월 울트라 소프트 린트가 없는 페이셜 코튼 티슈 민감성 피부를 위한 일회용 60Pcs 일회용 물티슈/아미슬리 코튼 페이스 타월 울트라 소프트 린트가 없는 페이셜 코튼 티슈 민감성 피부를 위한 일회용 60Pcs 일회용 물티슈_0.jpg,./img_files_in_coupang_baby_title/product_detail/물티슈/건티슈/no_brand/아미슬리 코튼 페이스 타월 울트라 소프트 린트가 없는 페이셜 코튼 티슈 민감성 피부를 위한 일회용 60Pcs 일회용 물티슈/아미슬리 코튼 페이스 타월 울트라 소프트 린트가 없는 페이셜 코튼 티슈 민감성 피부를 위한 일회용 60Pcs 일회용 물티슈_1.jpg",https://www.coupang.com/vp/products/4343794115?itemId=5087928908&vendorItemId=72397548878&sourceType=CATEGORY&categoryId=485881
24,25,,코튼 페이셜 티슈 100% 소프트 재사용 가능한 코튼 패드 린트프리 베이비 드라이 립스 메이크업 티슈: 오피스 제품,no_brand,,,,,,단일옵션,"18,800원",2021-01-13 15:59:12.752967,,,,./img_files_in_coupang_baby_title/product/물티슈/건티슈/no_brand/코튼 페이셜 티슈 100% 소프트 재사용 가능한 코튼 패드 린트프리 베이비 드라이 립스 메이크업 티슈: 오피스 제품.jpg,"./img_files_in_coupang_baby_title/product_detail/물티슈/건티슈/no_brand/코튼 페이셜 티슈 100% 소프트 재사용 가능한 코튼 패드 린트프리 베이비 드라이 립스 메이크업 티슈: 오피스 제품/코튼 페이셜 티슈 100% 소프트 재사용 가능한 코튼 패드 린트프리 베이비 드라이 립스 메이크업 티슈: 오피스 제품_0.jpg,./img_files_in_coupang_baby_title/product_detail/물티슈/건티슈/no_brand/코튼 페이셜 티슈 100% 소프트 재사용 가능한 코튼 패드 린트프리 베이비 드라이 립스 메이크업 티슈: 오피스 제품/코튼 페이셜 티슈 100% 소프트 재사용 가능한 코튼 패드 린트프리 베이비 드라이 립스 메이크업 티슈: 오피스 제품_1.jpg",https://www.coupang.com/vp/products/4343795201?itemId=5087932390&vendorItemId=72397548542&sourceType=CATEGORY&categoryId=485881
25,26,,실리안 코튼 드라이위프 엑스트라 소프트 엑스트라 틱 민감성 피부를 위한 일회용 페이스 티슈 베이비 워시클러즈 클렌징,no_brand,,,,,,단일옵션,"24,700원",2021-01-13 15:59:28.095714,,,,./img_files_in_coupang_baby_title/product/물티슈/건티슈/no_brand/실리안 코튼 드라이위프 엑스트라 소프트 엑스트라 틱 민감성 피부를 위한 일회용 페이스 티슈 베이비 워시클러즈 클렌징.jpg,"./img_files_in_coupang_baby_title/product_detail/물티슈/건티슈/no_brand/실리안 코튼 드라이위프 엑스트라 소프트 엑스트라 틱 민감성 피부를 위한 일회용 페이스 티슈 베이비 워시클러즈 클렌징/실리안 코튼 드라이위프 엑스트라 소프트 엑스트라 틱 민감성 피부를 위한 일회용 페이스 티슈 베이비 워시클러즈 클렌징_0.jpg,./img_files_in_coupang_baby_title/product_detail/물티슈/건티슈/no_brand/실리안 코튼 드라이위프 엑스트라 소프트 엑스트라 틱 민감성 피부를 위한 일회용 페이스 티슈 베이비 워시클러즈 클렌징/실리안 코튼 드라이위프 엑스트라 소프트 엑스트라 틱 민감성 피부를 위한 일회용 페이스 티슈 베이비 워시클러즈 클렌징_1.jpg",https://www.coupang.com/vp/products/4343793878?itemId=5087927936&vendorItemId=72397548450&sourceType=CATEGORY&categoryId=485881
26,27,,"HOONEX 울트라소프트 드라이 베이비 Wipes 100% 퓨어 코튼 민감성 피부를 위한 페이셜 티슈 라지 코튼 패드 7.87"" x 7.87""",no_brand,,,,,,단일옵션,"34,600원",2021-01-13 15:59:43.534271,,,,"./img_files_in_coupang_baby_title/product/물티슈/건티슈/no_brand/HOONEX 울트라소프트 드라이 베이비 Wipes 100% 퓨어 코튼 민감성 피부를 위한 페이셜 티슈 라지 코튼 패드 7.87"" x 7.87"".jpg","./img_files_in_coupang_baby_title/product_detail/물티슈/건티슈/no_brand/HOONEX 울트라소프트 드라이 베이비 Wipes 100% 퓨어 코튼 민감성 피부를 위한 페이셜 티슈 라지 코튼 패드 7.87"" x 7.87""/HOONEX 울트라소프트 드라이 베이비 Wipes 100% 퓨어 코튼 민감성 피부를 위한 페이셜 티슈 라지 코튼 패드 7.87"" x 7.87""_0.jpg,./img_files_in_coupang_baby_title/product_detail/물티슈/건티슈/no_brand/HOONEX 울트라소프트 드라이 베이비 Wipes 100% 퓨어 코튼 민감성 피부를 위한 페이셜 티슈 라지 코튼 패드 7.87"" x 7.87""/HOONEX 울트라소프트 드라이 베이비 Wipes 100% 퓨어 코튼 민감성 피부를 위한 페이셜 티슈 라지 코튼 패드 7.87"" x 7.87""_1.jpg",https://www.coupang.com/vp/products/4343793945?itemId=5087928208&vendorItemId=72397548566&sourceType=CATEGORY&categoryId=485881
27,28,,베이비 페이셜 코튼 티슈 600 카운트 베이비 드라이 와이프 민감성 피부를 위한 USA 내추럴 코튼으로 제작된 소프트 드라이,no_brand,,,,,,단일옵션,"44,500원",2021-01-13 15:59:58.944404,,,,./img_files_in_coupang_baby_title/product/물티슈/건티슈/no_brand/베이비 페이셜 코튼 티슈 600 카운트 베이비 드라이 와이프 민감성 피부를 위한 USA 내추럴 코튼으로 제작된 소프트 드라이.jpg,"./img_files_in_coupang_baby_title/product_detail/물티슈/건티슈/no_brand/베이비 페이셜 코튼 티슈 600 카운트 베이비 드라이 와이프 민감성 피부를 위한 USA 내추럴 코튼으로 제작된 소프트 드라이/베이비 페이셜 코튼 티슈 600 카운트 베이비 드라이 와이프 민감성 피부를 위한 USA 내추럴 코튼으로 제작된 소프트 드라이_0.jpg,./img_files_in_coupang_baby_title/product_detail/물티슈/건티슈/no_brand/베이비 페이셜 코튼 티슈 600 카운트 베이비 드라이 와이프 민감성 피부를 위한 USA 내추럴 코튼으로 제작된 소프트 드라이/베이비 페이셜 코튼 티슈 600 카운트 베이비 드라이 와이프 민감성 피부를 위한 USA 내추럴 코튼으로 제작된 소프트 드라이_1.jpg",https://www.coupang.com/vp/products/4343794845?itemId=5087931070&vendorItemId=72397548266&sourceType=CATEGORY&categoryId=485881
28,29,,4백 320pcs 로미미유 코튼 티슈 페이퍼 타월 베이비 케어 코튼 티슈 페이셜 드라이 립스 페이셜 티슈 메이크업 리무빌 베이비,no_brand,,,,,,단일옵션,"34,600원",2021-01-13 16:00:14.547020,,,,./img_files_in_coupang_baby_title/product/물티슈/건티슈/no_brand/4백 320pcs 로미미유 코튼 티슈 페이퍼 타월 베이비 케어 코튼 티슈 페이셜 드라이 립스 페이셜 티슈 메이크업 리무빌 베이비.jpg,"./img_files_in_coupang_baby_title/product_detail/물티슈/건티슈/no_brand/4백 320pcs 로미미유 코튼 티슈 페이퍼 타월 베이비 케어 코튼 티슈 페이셜 드라이 립스 페이셜 티슈 메이크업 리무빌 베이비/4백 320pcs 로미미유 코튼 티슈 페이퍼 타월 베이비 케어 코튼 티슈 페이셜 드라이 립스 페이셜 티슈 메이크업 리무빌 베이비_0.jpg,./img_files_in_coupang_baby_title/product_detail/물티슈/건티슈/no_brand/4백 320pcs 로미미유 코튼 티슈 페이퍼 타월 베이비 케어 코튼 티슈 페이셜 드라이 립스 페이셜 티슈 메이크업 리무빌 베이비/4백 320pcs 로미미유 코튼 티슈 페이퍼 타월 베이비 케어 코튼 티슈 페이셜 드라이 립스 페이셜 티슈 메이크업 리무빌 베이비_1.jpg",https://www.coupang.com/vp/products/4343793649?itemId=5087927370&vendorItemId=72397548128&sourceType=CATEGORY&categoryId=485881
29,30,,DAIYASHI 소프트 드라이 립 오가닉 코튼 페이셜 티슈 천연 고시피움 전용으로 제작 베이비 센슈티브 스킨케어 및 제거 페이,no_brand,,,,,,단일옵션,"36,600원",2021-01-13 16:00:30.019166,,,,./img_files_in_coupang_baby_title/product/물티슈/건티슈/no_brand/DAIYASHI 소프트 드라이 립 오가닉 코튼 페이셜 티슈 천연 고시피움 전용으로 제작 베이비 센슈티브 스킨케어 및 제거 페이.jpg,"./img_files_in_coupang_baby_title/product_detail/물티슈/건티슈/no_brand/DAIYASHI 소프트 드라이 립 오가닉 코튼 페이셜 티슈 천연 고시피움 전용으로 제작 베이비 센슈티브 스킨케어 및 제거 페이/DAIYASHI 소프트 드라이 립 오가닉 코튼 페이셜 티슈 천연 고시피움 전용으로 제작 베이비 센슈티브 스킨케어 및 제거 페이_0.jpg,./img_files_in_coupang_baby_title/product_detail/물티슈/건티슈/no_brand/DAIYASHI 소프트 드라이 립 오가닉 코튼 페이셜 티슈 천연 고시피움 전용으로 제작 베이비 센슈티브 스킨케어 및 제거 페이/DAIYASHI 소프트 드라이 립 오가닉 코튼 페이셜 티슈 천연 고시피움 전용으로 제작 베이비 센슈티브 스킨케어 및 제거 페이_1.jpg",https://www.coupang.com/vp/products/4343793970?itemId=5087928332&vendorItemId=72397548115&sourceType=CATEGORY&categoryId=485881
30,31,,안면 클렌징과 베이비 케어를 위한 KOOBA 소프트 드라이 립스 코튼 티스 민감성 피부를 위한 뷰티 코튼 타월 일회용 옷 저자,no_brand,,,,,,단일옵션,"18,600원",2021-01-13 16:00:45.661360,,,,./img_files_in_coupang_baby_title/product/물티슈/건티슈/no_brand/안면 클렌징과 베이비 케어를 위한 KOOBA 소프트 드라이 립스 코튼 티스 민감성 피부를 위한 뷰티 코튼 타월 일회용 옷 저자.jpg,"./img_files_in_coupang_baby_title/product_detail/물티슈/건티슈/no_brand/안면 클렌징과 베이비 케어를 위한 KOOBA 소프트 드라이 립스 코튼 티스 민감성 피부를 위한 뷰티 코튼 타월 일회용 옷 저자/안면 클렌징과 베이비 케어를 위한 KOOBA 소프트 드라이 립스 코튼 티스 민감성 피부를 위한 뷰티 코튼 타월 일회용 옷 저자_0.jpg,./img_files_in_coupang_baby_title/product_detail/물티슈/건티슈/no_brand/안면 클렌징과 베이비 케어를 위한 KOOBA 소프트 드라이 립스 코튼 티스 민감성 피부를 위한 뷰티 코튼 타월 일회용 옷 저자/안면 클렌징과 베이비 케어를 위한 KOOBA 소프트 드라이 립스 코튼 티스 민감성 피부를 위한 뷰티 코튼 타월 일회용 옷 저자_1.jpg",https://www.coupang.com/vp/products/4343793921?itemId=5087928067&vendorItemId=72397548218&sourceType=CATEGORY&categoryId=485881
31,32,,민감성 피부를 위한 케어보어 울트라 소프트 드라이 베이비 물티슈 무향 다목적 퓨어 코튼 티슈 300 카운트,no_brand,,,,,,단일옵션,"56,400원",2021-01-13 16:01:01.199187,,,,./img_files_in_coupang_baby_title/product/물티슈/건티슈/no_brand/민감성 피부를 위한 케어보어 울트라 소프트 드라이 베이비 물티슈 무향 다목적 퓨어 코튼 티슈 300 카운트.jpg,"./img_files_in_coupang_baby_title/product_detail/물티슈/건티슈/no_brand/민감성 피부를 위한 케어보어 울트라 소프트 드라이 베이비 물티슈 무향 다목적 퓨어 코튼 티슈 300 카운트/민감성 피부를 위한 케어보어 울트라 소프트 드라이 베이비 물티슈 무향 다목적 퓨어 코튼 티슈 300 카운트_0.jpg,./img_files_in_coupang_baby_title/product_detail/물티슈/건티슈/no_brand/민감성 피부를 위한 케어보어 울트라 소프트 드라이 베이비 물티슈 무향 다목적 퓨어 코튼 티슈 300 카운트/민감성 피부를 위한 케어보어 울트라 소프트 드라이 베이비 물티슈 무향 다목적 퓨어 코튼 티슈 300 카운트_1.jpg",https://www.coupang.com/vp/products/4343793496?itemId=5087926902&vendorItemId=72397547548&sourceType=CATEGORY&categoryId=485881
32,33,,루치나 베이비 페이셜 코튼 티슈 민감성 피부를 위한 USA 내추럴 코튼으로 제작된 600 카운트 베이비 드라이 닦아스 소프트,no_brand,,,,,,단일옵션,"64,300원",2021-01-13 16:01:16.778072,,,,./img_files_in_coupang_baby_title/product/물티슈/건티슈/no_brand/루치나 베이비 페이셜 코튼 티슈 민감성 피부를 위한 USA 내추럴 코튼으로 제작된 600 카운트 베이비 드라이 닦아스 소프트.jpg,"./img_files_in_coupang_baby_title/product_detail/물티슈/건티슈/no_brand/루치나 베이비 페이셜 코튼 티슈 민감성 피부를 위한 USA 내추럴 코튼으로 제작된 600 카운트 베이비 드라이 닦아스 소프트/루치나 베이비 페이셜 코튼 티슈 민감성 피부를 위한 USA 내추럴 코튼으로 제작된 600 카운트 베이비 드라이 닦아스 소프트_0.jpg,./img_files_in_coupang_baby_title/product_detail/물티슈/건티슈/no_brand/루치나 베이비 페이셜 코튼 티슈 민감성 피부를 위한 USA 내추럴 코튼으로 제작된 600 카운트 베이비 드라이 닦아스 소프트/루치나 베이비 페이셜 코튼 티슈 민감성 피부를 위한 USA 내추럴 코튼으로 제작된 600 카운트 베이비 드라이 닦아스 소프트_1.jpg",https://www.coupang.com/vp/products/4343793563?itemId=5087927099&vendorItemId=72397547251&sourceType=CATEGORY&categoryId=485881
33,34,,"베이비 및 성인용 일회용 드라이클리프 300 카운트(10팩) - 울트라 소프트 코튼 티슈 워시클러치 - 7"" x 13"" 트래블 사이즈 -",no_brand,,,,,,단일옵션,"98,000원",2021-01-13 16:01:32.631797,,,,"./img_files_in_coupang_baby_title/product/물티슈/건티슈/no_brand/베이비 및 성인용 일회용 드라이클리프 300 카운트(10팩) - 울트라 소프트 코튼 티슈 워시클러치 - 7"" x 13"" 트래블 사이즈 -.jpg","./img_files_in_coupang_baby_title/product_detail/물티슈/건티슈/no_brand/베이비 및 성인용 일회용 드라이클리프 300 카운트(10팩) - 울트라 소프트 코튼 티슈 워시클러치 - 7"" x 13"" 트래블 사이즈 -/베이비 및 성인용 일회용 드라이클리프 300 카운트(10팩) - 울트라 소프트 코튼 티슈 워시클러치 - 7"" x 13"" 트래블 사이즈 -_0.jpg,./img_files_in_coupang_baby_title/product_detail/물티슈/건티슈/no_brand/베이비 및 성인용 일회용 드라이클리프 300 카운트(10팩) - 울트라 소프트 코튼 티슈 워시클러치 - 7"" x 13"" 트래블 사이즈 -/베이비 및 성인용 일회용 드라이클리프 300 카운트(10팩) - 울트라 소프트 코튼 티슈 워시클러치 - 7"" x 13"" 트래블 사이즈 -_1.jpg",https://www.coupang.com/vp/products/4343793991?itemId=5087928381&vendorItemId=72397547469&sourceType=CATEGORY&categoryId=485881
34,35,,라밀라 200카운트 코튼 페이셜 티슈 100% 소프트 재사용 가능한 코튼 티슈 린트프리 베이비 Dry Wipes 메이크업 티슈 : 사무,no_brand,,,,,,단일옵션,"30,700원",2021-01-13 16:01:47.982615,,,,./img_files_in_coupang_baby_title/product/물티슈/건티슈/no_brand/라밀라 200카운트 코튼 페이셜 티슈 100% 소프트 재사용 가능한 코튼 티슈 린트프리 베이비 Dry Wipes 메이크업 티슈 : 사무.jpg,"./img_files_in_coupang_baby_title/product_detail/물티슈/건티슈/no_brand/라밀라 200카운트 코튼 페이셜 티슈 100% 소프트 재사용 가능한 코튼 티슈 린트프리 베이비 Dry Wipes 메이크업 티슈 : 사무/라밀라 200카운트 코튼 페이셜 티슈 100% 소프트 재사용 가능한 코튼 티슈 린트프리 베이비 Dry Wipes 메이크업 티슈 : 사무_0.jpg,./img_files_in_coupang_baby_title/product_detail/물티슈/건티슈/no_brand/라밀라 200카운트 코튼 페이셜 티슈 100% 소프트 재사용 가능한 코튼 티슈 린트프리 베이비 Dry Wipes 메이크업 티슈 : 사무/라밀라 200카운트 코튼 페이셜 티슈 100% 소프트 재사용 가능한 코튼 티슈 린트프리 베이비 Dry Wipes 메이크업 티슈 : 사무_1.jpg",https://www.coupang.com/vp/products/4343793750?itemId=5087927538&vendorItemId=72397546996&sourceType=CATEGORY&categoryId=485881
35,36,,건조하고 젖은 일회용 스킨케어 페이셜 코튼 티슈 엑스트라 두께의 소프트 드라이 립 민감성 피부를 위한 클렌징 페이스 타,no_brand,,,,,,단일옵션,"20,800원",2021-01-13 16:02:03.577284,,,,./img_files_in_coupang_baby_title/product/물티슈/건티슈/no_brand/건조하고 젖은 일회용 스킨케어 페이셜 코튼 티슈 엑스트라 두께의 소프트 드라이 립 민감성 피부를 위한 클렌징 페이스 타.jpg,"./img_files_in_coupang_baby_title/product_detail/물티슈/건티슈/no_brand/건조하고 젖은 일회용 스킨케어 페이셜 코튼 티슈 엑스트라 두께의 소프트 드라이 립 민감성 피부를 위한 클렌징 페이스 타/건조하고 젖은 일회용 스킨케어 페이셜 코튼 티슈 엑스트라 두께의 소프트 드라이 립 민감성 피부를 위한 클렌징 페이스 타_0.jpg,./img_files_in_coupang_baby_title/product_detail/물티슈/건티슈/no_brand/건조하고 젖은 일회용 스킨케어 페이셜 코튼 티슈 엑스트라 두께의 소프트 드라이 립 민감성 피부를 위한 클렌징 페이스 타/건조하고 젖은 일회용 스킨케어 페이셜 코튼 티슈 엑스트라 두께의 소프트 드라이 립 민감성 피부를 위한 클렌징 페이스 타_1.jpg",https://www.coupang.com/vp/products/4343793277?itemId=5087926199&vendorItemId=72397546928&sourceType=CATEGORY&categoryId=485881
36,37,,울트라 소프트와 두툼한 드라이 립 6팩 민감성 피부를 위한 100% 코튼 타월 페이스 클렌징 메이크업 리무빙 표면 클렌징,no_brand,,,,,,단일옵션,"40,600원",2021-01-13 16:02:19.056207,,,,./img_files_in_coupang_baby_title/product/물티슈/건티슈/no_brand/울트라 소프트와 두툼한 드라이 립 6팩 민감성 피부를 위한 100% 코튼 타월 페이스 클렌징 메이크업 리무빙 표면 클렌징.jpg,"./img_files_in_coupang_baby_title/product_detail/물티슈/건티슈/no_brand/울트라 소프트와 두툼한 드라이 립 6팩 민감성 피부를 위한 100% 코튼 타월 페이스 클렌징 메이크업 리무빙 표면 클렌징/울트라 소프트와 두툼한 드라이 립 6팩 민감성 피부를 위한 100% 코튼 타월 페이스 클렌징 메이크업 리무빙 표면 클렌징_0.jpg,./img_files_in_coupang_baby_title/product_detail/물티슈/건티슈/no_brand/울트라 소프트와 두툼한 드라이 립 6팩 민감성 피부를 위한 100% 코튼 타월 페이스 클렌징 메이크업 리무빙 표면 클렌징/울트라 소프트와 두툼한 드라이 립 6팩 민감성 피부를 위한 100% 코튼 타월 페이스 클렌징 메이크업 리무빙 표면 클렌징_1.jpg",https://www.coupang.com/vp/products/4343793477?itemId=5087926876&vendorItemId=72397547061&sourceType=CATEGORY&categoryId=485881
